{"$schema":"https://json-schema.org/draft/2020-12/schema","$id":"https://carbonactual.local/schema/ecosystem-improvement.v1.json","title":"Carbon Actual Reusable Improvement Record","type":"object","additionalProperties":false,"required":["schema_version","improvement_id","originating_product","capability_id","problem","change","evidence","affected_consumers","compatibility_impact","maturity_transition","provenance"],"properties":{"schema_version":{"const":"1.0.0"},"improvement_id":{"type":"string","minLength":1},"originating_product":{"type":"string","minLength":1},"capability_id":{"type":"string","pattern":"^cap\\."},"problem":{"type":"string","minLength":1},"change":{"type":"string","minLength":1},"evidence":{"type":"array","items":{"type":"string"}},"affected_consumers":{"type":"array","items":{"type":"string"}},"compatibility_impact":{"type":"string","minLength":1},"maturity_transition":{"enum":["local-use→reusable-candidate","reusable-candidate→shared","shared→canonical","canonical→deprecated"]},"provenance":{"type":"string","minLength":1}}}
