{"schema_version":"1.0.0","improvement_id":"improvement.example.001","originating_product":"spotist","capability_id":"cap.discovery","problem":"Provider-specific discovery responses differed in evidence and provenance shape.","change":"Normalize provider responses into canonical discovery result plus evidence references.","evidence":["test:provider-normalization","observation:seek-2026-09-16"],"affected_consumers":["spotist","omni-economic","ngin","naire"],"compatibility_impact":"Additive canonical result fields; existing provider adapters retain their compatibility identifiers.","maturity_transition":"reusable-candidate→shared","provenance":"Originated in SPOTIST; generalized through the canonical discovery contract."}
